<?xml version = "1.0" encoding = "UTF-8"?>
<!DOCTYPE webpage SYSTEM "http://invalid.domain.com/testCTS/libs/DTDs/webpage.dtd">
<!--

    Copyright (c) 2018 Oracle and/or its affiliates. All rights reserved.

    This program and the accompanying materials are made available under the
    terms of the Eclipse Public License v. 2.0, which is available at
    http://www.eclipse.org/legal/epl-2.0.

    This Source Code may also be made available under the following Secondary
    Licenses when the conditions for such availability set forth in the
    Eclipse Public License v. 2.0 are satisfied: GNU General Public License,
    version 2 with the GNU Classpath Exception, which is available at
    https://www.gnu.org/software/classpath/license.html.

    SPDX-License-Identifier: EPL-2.0 OR GPL-2.0 WITH Classpath-exception-2.0

-->

<webpage title = "CTS Example Web Page">
	<introduction>This web page is an example of what a CTS web
		page may look like.  This is the example introduction section.
		The quick brown fox jumped over the lazy dog.  The quick brown
		fox jumped over the lazy dog.  All work and no play makes Jack
		a dull boy.  Got to <link url="http://www.espn.com">ESPN.com</link>
		to receive your prize.
	</introduction>
	<sections>
		<section title = "Documents">
			<sub-section>
				This is an example of a sub-section within the 
				documents section.  This element can contain mixed
				content.  Meaning this element can contain PCDATA
				as well as url elements.  Here is a nested link element
				that points to
				<link url="http://www.sun.com">Sun's web site</link>.
			</sub-section>
			<sub-section>
				This is an example of another sub-section within the 
				documents section.
			</sub-section>
		</section>
		<section title = "Presentations">
			<sub-section>
				This is an example of a sub-section within the 
				documents section.  This element can contain mixed
				content.  Meaning this element can contain PCDATA
				as well as url elements.  Here is a nested link element
				that points to
				<link url="http://www.sun.com">Sun's web site</link>.
			</sub-section>
		</section>
		<list title="List 1" numbered="FALSE">
		  <list-element>
		    List item 1
		  </list-element>
		  <list-element>
		    List item 2
		  </list-element>
		  <list-element>
		    List item 3 is a link to
		    <link url="http://www.sun.com">Sun's web page</link>
		  </list-element>
		</list>
		<image title="Picture 1"
		       url="file:///D:/Download/cts-web-page/maya.jpg"
		       position="CENTER"/>
		<table title="Table 1 Title" row-labels="FALSE">
		  <col-label>Column 1</col-label>
		  <col-label>Column 2</col-label>
		  <col-label>Column 3</col-label>
		  <col-label>Column 4</col-label>
		  <row-data label="Row 1">
		    <row-element>Value 1.1</row-element>
		    <row-element>Value 2.1</row-element>
		    <row-element>Value 3.1</row-element>
		    <row-element>Value 4.1</row-element>
		  </row-data>
		  <row-data label="Row 2">
		    <row-element>Value 1.2</row-element>
		    <row-element>Value 2.2</row-element>
		    <row-element>Value 3.2</row-element>
		    <row-element>Value 4.2</row-element>
		  </row-data>
		  <row-data label="Row 3">
		    <row-element>Value 1.3</row-element>
		    <row-element>Value 2.3</row-element>
		    <row-element>Value 3.3</row-element>
		    <row-element>Value 4.3</row-element>
		  </row-data>
		</table>
	</sections>
	<footer>
		This web page created by the CTS group.
	</footer>
</webpage>
